{
  "version": 1,
  "id": "first-communication-batch",
  "preparedAt": "2026-10-23T04:10:45.611436+00:00",
  "scope": "Lote de preparação com revisão assistida por agente; não publicado e sem declaração de revisão humana.",
  "contexts": [
    {
      "id": "anm-conceitos",
      "kind": "instruction",
      "label": "Comando compartilhado",
      "text": "Julgue os itens a seguir, relativos a conceitos e finalidades da publicidade.",
      "sourceDocumentId": "source-038-anm-010-01-paper",
      "sourcePage": 1
    },
    {
      "id": "anm-merchandising",
      "kind": "instruction",
      "label": "Comando compartilhado",
      "text": "Em relação ao merchandising, à publicidade legal e à administração de propaganda, julgue os próximos itens.",
      "sourceDocumentId": "source-038-anm-010-01-paper",
      "sourcePage": 1
    },
    {
      "id": "anm-producao",
      "kind": "instruction",
      "label": "Comando compartilhado",
      "text": "Acerca do design thinking, da divulgação institucional, das produções publicitárias em mídias digitais e offline e do briefing, julgue os seguintes itens.",
      "sourceDocumentId": "source-038-anm-010-01-paper",
      "sourcePage": 1
    },
    {
      "id": "codevasf-conceitos",
      "kind": "instruction",
      "label": "Comando compartilhado",
      "text": "Em relação aos conceitos e finalidades da publicidade, julgue os itens seguintes.",
      "sourceDocumentId": "source-989-codevasf-010-01-paper",
      "sourcePage": 1
    },
    {
      "id": "codevasf-campanha",
      "kind": "instruction",
      "label": "Comando compartilhado",
      "text": "No que se refere à campanha publicitária, julgue os próximos itens.",
      "sourceDocumentId": "source-989-codevasf-010-01-paper",
      "sourcePage": 1
    },
    {
      "id": "alce-texto-13a1-i",
      "kind": "passage",
      "label": "Texto 13A1-I",
      "text": "Desde 2019, tramita na Assembleia Legislativa do estado Ceará um projeto de lei para proibir os canudos plásticos em todo o estado. Em Fortaleza, uma lei municipal com tal proibição já está em vigor. Questionado, o secretário de Estado do meio ambiente, assim se manifestou: “Somos favoráveis que a legislação, não só no Ceará, mas também em todo o Brasil, proíba o canudo plástico. Porém, mais importante do que a própria lei, é a sua eficácia. É preciso uma nova mentalidade de consumo. Estamos tentando fazer isso com o Selo Empresa Sustentável, que premia empresas com boas práticas de desenvolvimento sustentável. É uma boa alternativa”. Redação. Alunos da rede pública criam canudo ecológico a partir da cana de açúcar no interior. Diário do Nordeste, 5 jun. 2020. Internet: <https://diariodonordeste.verdesmares.com.br> (com adaptações).",
      "sourceDocumentId": "source-539-alce-016-01-paper",
      "sourcePage": 1
    }
  ],
  "items": [
    {
      "id": "038-anm-010-01-q051",
      "paperId": "source-038-anm-010-01",
      "number": 51,
      "sourcePage": 1,
      "type": "true_false",
      "stem": "A publicidade não apenas reflete a realidade, mas também contribui para a construção de uma hiper-realidade, na qual os signos e símbolos publicitários substituem a experiência direta do consumidor com os produtos.",
      "options": [],
      "contextIds": [
        "anm-conceitos"
      ],
      "answer": {
        "documentId": "source-038-anm-010-01-key",
        "sourcePage": 1,
        "stage": "definitive",
        "result": "valid",
        "value": true
      },
      "mappingSuggestions": [
        {
          "syllabusItemId": "camara-2026-divulgacao-institucional-1-1",
          "status": "suggested",
          "justification": "Avalia a construção simbólica da realidade pela publicidade, dentro das teorias da publicidade."
        }
      ],
      "review": {
        "mode": "agent_assisted",
        "contentCompared": true,
        "contextCompared": true,
        "answerKeyCompared": true,
        "publicationDecision": "pending",
        "temporalScope": "conceptual",
        "temporalNote": "Item conceitual, sem atualização silenciosa do enunciado ou do gabarito histórico.",
        "blockers": [
          "publication_contract_and_renderer_pending"
        ],
        "rightsReview": "not_assessed"
      }
    },
    {
      "id": "038-anm-010-01-q053",
      "paperId": "source-038-anm-010-01",
      "number": 53,
      "sourcePage": 1,
      "type": "true_false",
      "stem": "A publicidade desempenha um papel crucial na comunicação de marketing, atuando como uma ferramenta de persuasão para influenciar consumidores em diferentes etapas do processo de compra, desde a conscientização sobre o produto até a decisão de compra.",
      "options": [],
      "contextIds": [
        "anm-conceitos"
      ],
      "answer": {
        "documentId": "source-038-anm-010-01-key",
        "sourcePage": 1,
        "stage": "definitive",
        "result": "valid",
        "value": true
      },
      "mappingSuggestions": [
        {
          "syllabusItemId": "camara-2026-divulgacao-institucional-2-7",
          "status": "suggested",
          "justification": "Discute a persuasão publicitária nas etapas do processo de decisão do consumidor."
        }
      ],
      "review": {
        "mode": "agent_assisted",
        "contentCompared": true,
        "contextCompared": true,
        "answerKeyCompared": true,
        "publicationDecision": "pending",
        "temporalScope": "conceptual",
        "temporalNote": "Item conceitual, sem atualização silenciosa do enunciado ou do gabarito histórico.",
        "blockers": [
          "publication_contract_and_renderer_pending"
        ],
        "rightsReview": "not_assessed"
      }
    },
    {
      "id": "038-anm-010-01-q054",
      "paperId": "source-038-anm-010-01",
      "number": 54,
      "sourcePage": 1,
      "type": "true_false",
      "stem": "A publicidade é uma atividade semiótica, na qual são utilizados signos e símbolos para a construção de universos significativos que agregam valor emocional e funcional às marcas e produtos.",
      "options": [],
      "contextIds": [
        "anm-conceitos"
      ],
      "answer": {
        "documentId": "source-038-anm-010-01-key",
        "sourcePage": 1,
        "stage": "definitive",
        "result": "valid",
        "value": true
      },
      "mappingSuggestions": [
        {
          "syllabusItemId": "camara-2026-divulgacao-institucional-1-1",
          "status": "suggested",
          "justification": "Avalia a publicidade como atividade semiótica e a agregação simbólica de valor."
        }
      ],
      "review": {
        "mode": "agent_assisted",
        "contentCompared": true,
        "contextCompared": true,
        "answerKeyCompared": true,
        "publicationDecision": "pending",
        "temporalScope": "conceptual",
        "temporalNote": "Item conceitual, sem atualização silenciosa do enunciado ou do gabarito histórico.",
        "blockers": [
          "publication_contract_and_renderer_pending"
        ],
        "rightsReview": "not_assessed"
      }
    },
    {
      "id": "038-anm-010-01-q055",
      "paperId": "source-038-anm-010-01",
      "number": 55,
      "sourcePage": 1,
      "type": "true_false",
      "stem": "A função denotativa dos signos publicitários é considerada o aspecto central da comunicação, ao passo que a função conotativa, associada a significados culturais e simbólicos, tem um papel secundário no processo de persuasão.",
      "options": [],
      "contextIds": [
        "anm-conceitos"
      ],
      "answer": {
        "documentId": "source-038-anm-010-01-key",
        "sourcePage": 1,
        "stage": "definitive",
        "result": "valid",
        "value": false
      },
      "mappingSuggestions": [
        {
          "syllabusItemId": "camara-2026-divulgacao-institucional-1-1",
          "status": "suggested",
          "justification": "Discute denotação e conotação dos signos publicitários e seus papéis na persuasão."
        }
      ],
      "review": {
        "mode": "agent_assisted",
        "contentCompared": true,
        "contextCompared": true,
        "answerKeyCompared": true,
        "publicationDecision": "pending",
        "temporalScope": "conceptual",
        "temporalNote": "Item conceitual, sem atualização silenciosa do enunciado ou do gabarito histórico.",
        "blockers": [
          "publication_contract_and_renderer_pending"
        ],
        "rightsReview": "not_assessed"
      }
    },
    {
      "id": "038-anm-010-01-q056",
      "paperId": "source-038-anm-010-01",
      "number": 56,
      "sourcePage": 1,
      "type": "true_false",
      "stem": "A administração de propaganda deve focar-se prioritariamente na originalidade e na criatividade das campanhas, os dois aspectos determinantes do sucesso de uma marca; o entendimento do comportamento do consumidor e a segmentação de mercado, embora tenham importância secundária nesse processo, não devem ser negligenciados.",
      "options": [],
      "contextIds": [
        "anm-merchandising"
      ],
      "answer": {
        "documentId": "source-038-anm-010-01-key",
        "sourcePage": 1,
        "stage": "definitive",
        "result": "valid",
        "value": false
      },
      "mappingSuggestions": [
        {
          "syllabusItemId": "camara-2026-divulgacao-institucional-1-2",
          "status": "suggested",
          "justification": "Relaciona decisões de administração publicitária, criatividade, comportamento e segmentação."
        },
        {
          "syllabusItemId": "camara-2026-divulgacao-institucional-2-5",
          "status": "suggested",
          "justification": "Relaciona decisões de administração publicitária, criatividade, comportamento e segmentação."
        }
      ],
      "review": {
        "mode": "agent_assisted",
        "contentCompared": true,
        "contextCompared": true,
        "answerKeyCompared": true,
        "publicationDecision": "pending",